<?xml version="1.0" encoding="UTF-8" ?>
<listacursos xmlns:xsi="http://www.w3.org/2001/XMLSchema-instance"
            xsi:noNamespaceSchemaLocation="ejercicioOCHO.xsd">
<curso>
    <dni>123a</dni>
    <nombre>Antonio</nombre>
    <apellidoUno>Rodriguez</apellidoUno>
    <listaAsignaturas>
        <nombre codigo="QP3">
            <nombre>Matematicas</nombre>
            <profesor>
                <NRP>12R</NRP>
                <nombre>Luis</nombre>
                <apellidoUno>Fernandez</apellidoUno>
            </profesor>
        </nombre>
    </listaAsignaturas>
</curso>
</listacursos>